{"format":"flyology.tla.trace/2","model":{"module":"Counter","configuration":"Counter.cfg","source_sha256":"f2de83b964b04c4faa11c8335dc1c30f4f75bb3a7708bae623b053fae010c8d4","configuration_sha256":"d0189bfff2efbf9a8ee3606e87378f24de9525ededaa54d0b31309721ad95dbf","toolchain":"tla2tools-1.8.0+4ad12e8"},"initial":{"state":{"count":0,"lastAction":"Init"}},"steps":[{"index":1,"action":"Counter!Increment","role":"increment","input":{"delta":1},"expected":{"outcome":{"accepted":true},"state":{"count":1,"lastAction":"Increment"}},"model_source":"Counter!Increment"},{"index":2,"action":"Counter!Increment","role":"increment","input":{"delta":1},"expected":{"outcome":{"accepted":true},"state":{"count":2,"lastAction":"Increment"}},"model_source":"Counter!Increment"}]}
